{
  "$schema": "https://json-schema.org/draft/2020-12/schema",
  "$id": "certification-record.schema.json",
  "title": "CertificationRecord",
  "description": "One certification decision, produced by scripts/certify.py. skill is a contract Skill whose status is the decision's outcome. A certified record is the canonical source of truth for the skill (registry/skills/<id>.json); every record, pass or fail, is appended to registry/ledger.jsonl. decision.rulings says exactly which policy rule passed or failed and why. Consumers must ignore unknown keys.",
  "type": "object",
  "required": ["recordVersion", "skill", "teacher", "transfer", "verification", "decision", "events"],
  "properties": {
    "recordVersion": { "type": "integer", "minimum": 1 },
    "skill": { "$ref": "contracts/skill.schema.json" },
    "teacher": { "$ref": "contracts/agent-identity.schema.json" },
    "procedureId": { "type": "string", "minLength": 1, "description": "The Memorable procedure the student was given." },
    "transfer": {
      "type": "object",
      "required": ["student", "examCase", "artifact", "passed"],
      "properties": {
        "student": { "$ref": "contracts/agent-identity.schema.json" },
        "examCase": { "type": "string", "minLength": 1, "description": "Id of a case in demo/cases.json." },
        "examCompany": { "type": "string" },
        "runId": { "type": "string" },
        "artifact": {
          "type": "object",
          "properties": {
            "type": { "$ref": "contracts/skill.schema.json#/$defs/ArtifactType" },
            "path": { "type": "string" }
          }
        },
        "passed": { "type": "boolean", "description": "True exactly when the skill was certified by this exam." }
      }
    },
    "verification": { "$ref": "contracts/verification-result.schema.json" },
    "decision": {
      "type": "object",
      "required": ["certified", "status", "policy", "summary", "failedRules", "rulings", "decidedAt", "inputsDigest"],
      "properties": {
        "certified": { "type": "boolean" },
        "status": { "$ref": "contracts/skill.schema.json#/$defs/SkillStatus" },
        "policy": {
          "type": "object",
          "required": ["id", "rules"],
          "properties": {
            "id": { "type": "string", "minLength": 1 },
            "rules": { "type": "array", "minItems": 1, "items": { "type": "string", "pattern": "^[a-z][a-z0-9_]*$" } },
            "requireIsolation": { "type": "boolean" }
          }
        },
        "summary": { "type": "string", "minLength": 1 },
        "failedRules": { "type": "array", "items": { "type": "string", "pattern": "^[a-z][a-z0-9_]*$" } },
        "rulings": {
          "type": "array",
          "minItems": 1,
          "items": {
            "type": "object",
            "required": ["rule", "passed", "reason", "evidence"],
            "properties": {
              "rule": { "type": "string", "pattern": "^[a-z][a-z0-9_]*$" },
              "passed": { "type": "boolean" },
              "reason": { "type": "string", "minLength": 1 },
              "evidence": { "type": "object" }
            }
          }
        },
        "decidedAt": { "type": "string", "pattern": "^\\d{4}-\\d{2}-\\d{2}T\\d{2}:\\d{2}:\\d{2}" },
        "inputsDigest": { "type": "string", "pattern": "^sha256:[0-9a-f]{64}$" }
      }
    },
    "events": { "type": "array", "items": { "$ref": "contracts/event.schema.json" } },
    "metrics": {
      "type": "object",
      "description": "Optional run metrics from the runtime, used only to rank certified records.",
      "properties": {
        "durationMs": { "type": "number", "minimum": 0 },
        "toolCalls": { "type": "integer", "minimum": 0 },
        "turns": { "type": "integer", "minimum": 0 },
        "costUsd": { "type": "number", "minimum": 0 }
      }
    }
  }
}
